{
  "schema_version": 1,
  "name": "string-pluck",
  "fs": 48000,
  "oversampling": 2,
  "duration": 1.0,
  "strings": [
    {
      "name": "G3",
      "params": {
        "L": 0.65,
        "dCore": 0.0008,
        "rhoCore": 7850,
        "ECore": 2.0e11,
        "f1Target": 196.0,
        "b1": 0.6,
        "b3": 2.0e-6
      },
      "grid": { "intervals": 130 },
      "initial_displacement": { "amplitude": 0.002, "position": 0.1 }
    }
  ],
  "observations": [
    { "name": "y", "kind": "string_displacement", "string": 0, "x": 0.27 }
  ],
  "feature_partials": 10
}
